rank,argument,topic
0.7735,"Firstly, you have to start thinking on the epic scale of the omnipotent being (i.e spanning the full extent of the universe, as well as those that might precede and survive it) something that seems to cause the suffering of several billion people might lead to creation of something that will benefit countless billions upon billions.",evo
0.8103333333,"If a fossil were found in a rock later that dated back to a radically different date than what has previously been found, and a study was done to show there was not a mistake, or a fluke, then evolution would have to be changed or dropped.",evo
0.8833333333,To protect the code of life the colective gene pool of the bacteria splits into two parts.,evo
0.782,So you used to beelive in evolution and the other teachings of science and have changed your mind?,evo
0.8093333333,"If evolutionary theory is flawed, what do you propose as a counter-theory?",evo
0.745,"But Darwin was, indeed, afraid of how his theory would be received and continued to refine it.",evo
0.843,But evolutionary biology no longer falls back to Darwin for validation.,evo
0.8059999999999999,But the materialist (!),evo
0.7726666667000001,"But since atheism claims all naturalism proves its concept, it really has a big advantage with science, doesnt it?",evo
0.784,"First, it is a common error (especially among the ""sociobiologists"") that all traits are the direct product of evolution, and that these traits must serve an immediate purpose.",evo
0.7753333333,"If evolution, true evolution, with progressive new traits developing into new species and eventually a new genus were to be seen then one would expect to see the formation of such new organs.",evo
0.7809999999999999,"Firstly, we did not evolve ""from"" other living species, but I digress.",evo
0.8009999999999999,"If you believe in evolution then everything, every trait is a result.",evo
0.81725,But you are not arguing against real evolution - and you haven't even got beyond the definition - to the observations and the theory.,evo
0.7979999999999999,"first of all, the story of creation does more than explain how the world came to be.",evo
0.82575,But Magical Creationists jumped on the finding as evidence for the co-existence of Dinosaurs and humans before Noahs Flood.,evo
0.802,"If religion is real, science will be happy to have proven it so.",evo
0.8009999999999999,"Sorry, as I stated earlier, I do not read much on creationist theories (unless I am looking to see how unscientific they are) only evolutionist ones actually written by evolutionists.",evo
0.782,"If by ""biological methods"", you mean is aware of its 'self' and its own 'biology', and how to 'own and operate' that biological 'self', i.e., to adjust, alter, and adapt that biology [knowledge of physical system, make-up and operation]then , yes, it must be at least unconsciously [or subconsciously, I'm not sure which is the better word] aware of how and to what extent it can act.",evo
0.9446666667,"Social Darwinism was the brain child of Herbert Spencer, who coined the phrase ""survival of the fittest"" that was misapplied by the common people to Darwin's theory of natural selection.",evo
0.8033333333,"If your question is whether we can show examples of organisms that have characteristics that would be expected if, for example, birds evolved from a lineage of theropod dinosaurs, the answer is yes.",evo
0.7985,"""If man truly evolved from lower life forms over millions, or hundreds of millions of years of evolution claims then the creation story of Adam and Eve is a complete myth.",evo
0.633,"If you can't really decide if a new species has emerged, becuase you're unsure how to define it, then, fine I'll accept that... therefore you can't show how it came about, because you don't even know if it has come about.",evo
0.7976666667,So geology is the only branch of science according to evolutionists?,evo
0.77475,If you think DNA identity is pure speculation you must deny that one can actually distinguish species much less different people via DNA.,evo
0.797,"I just want to highlight this part, Evolution does not talk about the origin of Life.",evo
0.7746666667000001,"But today, the evolutionary world-view justifies pursuit of research for the motivation of vainglory.",evo
0.7956666667,"If you are saying that all the different species I listed were on the ark, we can have a discussion about how many different species would fit on the ark.",evo
0.767,"If two individuals differ in a given allele, then at that point in their DNA, the molecules are precisely not the same!",evo
0.765,"My guess is, if evolutionists can't come up with something pretty concrete for naturalistic origins in....150 years, by then (2150) ID will have an established place in science.",evo
0.7928,"Nylon was developed by man, an unintended consequence of this is the nylon bug lives; that is not natural selection; unless you wish to posit a theory that any unintentional destruction of a species by man is likewise 'natural'.",evo
0.7573333333,"What evolutionist do though is they drag the strings to meet each other, claiming that this is the way it must have been but without reason to say why they are expected to intersect besides 'if evolution is true this must be true'.",evo
0.847,"First of all, the onus is really on creationists to come up with evidence for the coexistence of Adam & Eve with T rex.",evo
0.805,If furculae are apomorphic of Neotetanurae the fossil record should demonstrate that furculae are limited in distribution to members of this lineage.,evo
0.7916,"So it should be clear from reading what I said that my intent was to indicate that Darwin NEVER used the phrase ""survival of the fittest"" without also making a reference to natural selection.",evo
0.76825,"But still, by selecting desirable traits in animals, humans are able to produce whole populations of animals that have those traits.",evo
0.72,It seems that Marc does not have a foundation about what science is at all.,evo
0.7905,"Firstly, you have shown that you know far less about the universe than most, with your 'many spectrums and unknown wavelengths', but that's not overly surprising.",evo
0.7676666667,First try explaining why DNA changes in observed instances of evolution.,evo
0.8826666667,"But there is never any real evidence presented that falsifies evolutionary theory and all the other sciences that creationists lump under ""evolution"".",evo
0.7895,"But the way WarriorPoet stated the question leads me to believe that he considers evolution to be a series of steps, as on a ladder.",evo
0.8140000000000001,"** I have never referred to complex organisms as trash, although I may have referred to other people treating complex organisms as trash.",evo
0.792,Do you really think science is the only source to understand the world around?,evo
0.87875,"First of all natural selection is observable as a process, secondly mutations are a source of variability (do you dobut that also?)",evo
0.752,So you claim to have studied evolution and you have to have Darwin's finches explained to you.,evo
0.7882,But evolution doesn't depend on a single fossil.,evo
0.7659999999999999,"But then there views on evolution don't change that, why is it more reasonable to disbeleive in evolution and beleive in God than to beleive in both?",evo
0.758,Someone else pointed out to me that the dating center Austin used advertised that they were unable and unqualified to date 'young rocks'.,evo
0.6805,But you have challenged science with your beliefs.,evo
0.795,Refuting creationism isn't a problem.,evo
0.769,If humans have the capacity to evolve so does God's other creations.,evo
0.7865,But the real question of course is whether they evolved or created.,evo
0.77025,Some of your evolutionary pals don't even know how the birds evolved.,evo
0.758,"In order to be the total opposite, Evolution would need to say that the Earth is -6000 years old, created in a negative week by Satan, yeah yeah you get the point.",evo
0.8079999999999999,"But marc - the proponents of ID are always at great pains to explain that this 'higher power' need not be god, and they are not trying to push religion.",evo
0.764,"Sorry, but random mutations are known to generate genetic novelties and are involved in evolution.",evo
0.833,Creationists are in no position to call drivel what they don't have the intellectual tools to understand.,evo
0.78025,"If the theory can stand up to the harsh tests of scientific method, it can easily stand up to the firebrand skepticism spouted from the pulpits of the ringleaders of some 60% of Americans.",evo
0.7795,Firstly we will examine natural selection.,evo
0.77925,But at least Evolutionist can give physical proofs for their beliefs.,evo
0.775,But you're the one who made the categorical statement... Berlinski doesn't believe in evolution.,evo
0.7573333333,"You do realize that the poster in quesion that Pandion is talking about has constantly attacked evolution, science, the personal beliefs of other posters, and has constantly refused to post anything that would even remotely hint at vestiges of any scientific or rational knowledge?",evo
0.7763333333,But scientific proposals and theories must be reviewed by their peers.,evo
0.7256666667,so why have darwinists ignored symbiosis for decades if it was so compatible?,evo
0.72025,"If the flood is a miracle but actually happened, the evidence to the contrary means that your god created it.",evo
0.77425,"Some evolutionists do purposely set out to decieve people with frauds (such as some of the countless so called ape men, the embryonic recapitulation and so on) and it is these people that I am attacking.",evo
0.71625,"So it appears insects evolve rather rapidly, your points are refuted by the experts, in the future rely on sources that don't lie to you.",evo
0.7665,"So many Creationists resort to cheating, distorting, and otherwise being dishonest in an attempt to make it appear that their fundamentalist religious position is as scientifically sound as the real scientific position.",evo
0.72425,Supersport: There is nothing in Darwinian thought that says animals are incapable of itelligence.,evo
0.7716666667000001,If they can interbreed but dont then I would assume you and I couldnt agree on whether it was a species or not since you seem to think only animals that can not interbreed are different species.,evo
0.7712,"If a naturalistic interpretation of natural events and processes is ever to be replaced, it is more likely that it will be by a newer, better evolution of the naturalistic concept than by goddidit.",evo
0.7875,First life is not the foundation of evolution.,evo
0.8759999999999999,"So the naturalists are using the ToE to get governmental powers expanded, and to take power away from the people?",evo
0.77025,"If science does not seek natural explanations, it leaves open the possibility of explanations that are not natural, beyond natural, supernatural, etc.",evo
0.74925,"But since mutations do occur at random all the time, we don't need a special reason to believe that one of them was fortuitously adaptive.",evo
0.733,"So if I understand this correctly, we shouldn't believe evolution because it has gaps, but we should believe ID even though no one will/can say when the design happened, where it happened, what it was, or who the intelligence was?",evo
0.813,"if irrational evolution claims that random mutation equates to random changes over time, then yes it is irrational, but i am stumped to find one person who claims such things.",evo
0.77,"First, since 'beneficial' means 'adaptive' (if you do not mean this, then say what you do mean), and adaptive is strictly relative to local circumstances, I cannot give a non-relative, non-local, definite and universal response.",evo
0.7693333333,"But first, does evolution include the creation of the universe or only the adaptation and mutation etc of new species including man from ape or not necessarily man from ape but possibly?",evo
0.7465,So how did the circulatory system and respiratory system evolve slowly over time together?,evo
0.71925,"If it must be allowed into schools at all it should be confined to the religious studies classroom, not the science laboratory.",evo
0.76125,"Some textbooks also tell students that a slight increase in the average size of finch beaks, observed after a severe drought in the 1970s, shows how natural selection could produce a new species in only two hundred years.",evo
0.978,"If evolution is what actually happened to bring life on earth to the point it's at today... And if you subscribe to a literal interpretation of Genesis, then I agree that what is written in Genesis is 'untrue.'",evo
0.7123333332999999,"First you claim that the entire forelimb would have been useless, and when shown that it was not you claim that the feathers could not have existed because they would be useless, and now when shown a fossil that shows feathers, you are surprised that there are not more.",evo
0.8713333333,"So, anyway, to boil it all down to one question... ""Where has evolution been observed?""",evo
0.7495,so how are you going to go about looking for intelligent design in nature?,evo
0.73475,If you look at the sheer coindences involved in getting an intellegent human to evolve it is mind Boggling.,evo
0.7073333333,"If the U.S. wants to keep up with its overseas competitors scientifically, we must teach the newest science.",evo
0.763,Creationists are so pathetic.,evo
0.7145,"If your ""theory"" is that God created humans 6000 years ago and endowed them with an innate ability for language, but language must be learned in childhood, this does not quite count as a scientific theory for two reasons: 1) It doesn't explain why she created us as she did.",evo
0.524,But to this point you haven't explained anything and you haven't actually made a statement of theory.,evo
0.7618,"But couldn't climate change, specifically warmer temperatures start to favor individuals that have genes that have faster development to take advantage of warmer climates?",evo
0.682,"If ID is not science, rolling dice is not science.",evo
0.7006666667,If it's big - well it evolved big to survive.,evo
0.607,"If somebody is not an evolutionist to you he/she is not ""really"" a scientist is he?",evo
0.75425,It could only be called 'unbelievable coincidence' if you were to set out in advance what evolution had to achieve via co-option and then watched it achieve it.,evo
0.7445,"If you mean that Genesis is the re-writing of Babylonian myths within a new context, yes.",evo
0.7859999999999999,Some of Darwin's close friends were aware of his theory as early as 1844.,evo
0.706,"So if Dawkins personal belief is that YOUR belief is very evil, it doesn't bother you at all?",evo
0.867,"There are some posters here who try to have the best of all worlds... Whilst saying species is clearly defined, and that Darwin's Finch is evidence of evolution, the same poster claims that the finch sometimes is 'x' amount of species, sometimes 'y'.",evo
0.7696666667000001,"So if I were to provide you with an example of ""independent, identical mutation"" (even observed in the lab) with no evidence of direction, you've already decided that it must be directed because of your preconception that such mutations are impossible.",evo
0.75775,"First of all, it is plausible that the reptilian lung could have evolved into the avian lung.",evo
0.7783333333,"But, all the evidence points to stellar evolution pretty much in the way that the theories predict.",evo
0.7336666667,But science has a checks and balances system more strict than anything in any other field of human endeavor.,evo
0.777,"So, we've got Dembski who's put his theory to the test, and we've got evolutionaries who show where this test does not work.",evo
0.6983333333,If one were to write a biology example just using the information in the bible one would be sent back a few grades.,evo
0.7555,"first of all, it would mean that God set the universe into existence, allow it to naturally and spontaneously develop for billions of years, then step back in to intervene when humans attained a certain evolutionary level.",evo
0.804,"Sadly, creationism is an assertion of dogmatism.",evo
0.7542,"If you say so, but if they aren't related in evolution, they equally aren't related in ID.",evo
0.7336666667,"If the universe was created out of a singularity, and this universe is 'fine tuned' for producing black holes (themselves singularities) then couldn't the universe have evolved out of the product of previous universes that also produced black holes?",evo
0.7585,But even Jewish creationists are rare.,evo
0.696,"If the bacteria was not ""excited"" when looked at under ultra violet light, or infra red light, or very low levels of white light... the theory that bacteria were not naturally ""excited"" would be a theory supported by evidence.",evo
0.7523333333,So they turned the tables on you and asked the creationists to do what they demanded of the evolutionists.,evo
0.75225,"So in the human genome, taking the lower rate there are about 500 million mutations per replication - 1 for every 106 base pairs in a genome of 3 billion base pairs.",evo
0.8256666667,So you get your information on science from a creationist lawyer?,evo
0.7522,"If the specified morphological change takes place in fewer generations than that required by the pure chance of darwinist 'random,accidental, coincidental to fitness(adaptedness), genetic mutation', then you are talking adaptation (evolution) by specified organic response to specified environmental stimulus, (EAM or ""neo-lamarckism' or 'developmental evolution' or whatever, organismic teleologically directed response mechanism), and not the random, accidental, coincidental to outcome, ateleological, directionless, RM+NS, selectionist mechanism hypothesized by darwinists.",evo
0.7522,"Evolution can represent both an increase & decrease in entropy, since there is an increase in diversity of forms along with an increase in complexity.",evo
0.6883333333,"Sure, wja, evolution doesn't mention God, but that doesn't mean God couldn't have created it.",evo
0.6990000000000001,But fossils aren't directly dated.,evo
0.7440000000000001,"If a mutation appears that hinders an organisms survival, the organisms with that mutation will die off and won't spread that mutation to the rest of the population, so how does it pile up?",evo
0.75075,"So even if humans had just knocked down the dinosaurs numbers dramatically, they would not have necessarily left anymore fossils behind.",evo
0.7659999999999999,"First, evolution is a population-genetic process governed by four fundamental forces.",evo
0.75,What creation record?,evo
0.82675,First off I know many people who believe in both god and evolution.,evo
0.79325,"So discovering the supportive function of transporting proteins tells us precisely nothing about how Darwinian processes might have put together a rotary propulsion machine.""",evo
0.7246666667,But a mechanism is proposed: mutation and natural selection.,evo
0.8170000000000001,"Some of the hippo type creatures branched out and went into the ocean, they would have needed to keep coming back to shore and this is impractical so nature has a way of straightening things out by evolving the hippo-like creatures into whales using natural selection.",evo
0.6233333333,"If you actually paid attention to what Dawkins says instead of pretending that you know what he says, you'd know that Dawkins actually argues against misapplications of Darwinian ideas like eugenics and social Darwinism.",evo
0.8959999999999999,"If a scientific theory has been superceded, the creationists considers that to be a weakness.",evo
0.9755,"So pagans believe all kinds of stuff, usually nothing to do with evolution.",evo
0.7473333333,"So we have opposition to faith from Dawkins, and oposition to atheism from high profile public platforms, from creationists.",evo
0.6945,"So there is no basis to make the claim that Coelacanths havn't evolved during the last 70 million years, there's simply no record.",evo
0.7509999999999999,"Some mutations would be good at one time and bad at another, depending on the environment then.",evo
0.745,http://www.don-lindsay-archive.org/c...plication.html Give you a bit of information of duplication and mutations combined to yield new genetic information.,evo
0.7445,Biologists do not consider that most traits are attributable to single genes.,evo
0.6783333333,"First, how teaching intelligent design violates the constitution is beyond me.",evo
0.743,"Its this kind of kneejerk stupidity, that makes some people question how quickly evolutionists dismiss something.",evo
0.7005,"So, in fact you are now saying that Darwin was persuaded by Wallace to use a meaningless term in place of his term 'Natural Selection'.",evo
0.6495,"If Darwin's Finches live on the same island, then why did they separate?",evo
0.6815,"If between the thousands of species of dinosaurs that we know of and the thousands of species of birds there is a connection, then we should find many examples of fossils that represent several lines of diversification - one of these lines eventually became birds.",evo
0.6853333333,"Ok...so no matter which way it is -- whether we built up from one-celled organisms -- or if all the genes were in place from the beginning -- then it leads one to believe that common ancestory is true, right?",evo
0.73075,But evolution itself acknowledges the impossibility of spontaneously generated complexity!!!,evo
0.6843333333,So I find it hard to believe that one cell gained more and more intelligence or whatever to evolve into all living thing s that we know of today.,evo
0.6755,"So, is this an example of micro evolution, because they are still fruit flies, or macroevolution, since they are unable to breed with each other?",evo
0.763,"If ID proponents claim that gaps show evidence of some higher power, would a ""reduction"" in those gaps cause proponents of atheism to claim less evidence of a higher power?",evo
0.7125,But please explain these cave drawings and how primitive indians could draw such accurate cave drawings of creatures we now know to have existed through science but they could never have known about from 60 million year old bones.,evo
0.7385,"Simple I never used to believe the Ark Account, but now I do.",evo
0.7383333333,"If you think that you need to tell me -- who has a science degree and teaches science -- what science is, you have some serious problems.",evo
0.6723333333,First of all its theoretically possible to construct evolving systems which use mechanisms other than random mutation and natural selection.,evo
0.6913333333,But evolution does not deal with individuals.,evo
0.6295,How many of those scientists are biologists??,evo
0.67875,"If science is unprovable, where did all of these advances in the modern world come from?",evo
0.7575,Do you call a gene a physical structure too?,evo
0.6886666667,"First of all, you are assuming that evolution has a direction.",evo
0.736,"First, explain how ""reproductive success"", (by which I assume you mean your definition of 'fitness', (i.e., 'positive differential reproductive success compared with other organisms of the same kind in the same place at the same time' ) is ""a clear differential axis"", and just why that should be taken to actually mean something.",evo
0.727,"If you are refering to the dating of xenoliths in 1981 Mt. St. Helens dacites, the issue is not with the dating technique, but with Dr Steve Austin's apparent omission of observations.",evo
0.7356666667,"But of course, only an idiot would think that a given mutation is universally beneficial.",evo
0.7355,But what you must understand is that to fight evolution is to fight science itself.,evo
0.7943333333,"If modern evolutionary understanding of speciation is correct, then at least some species are required to show incomplete separation, because they will be partway along the journey to speciation.",evo
0.7065,But the medium ground finch and the small ground finch are distinguishable only by the size of their beak which is adaptive to a specific food.,evo
0.679,"If evolutionary theory is going to be replaced, there must be something to replace it.",evo
0.70725,"If it can be coincidentally adaptive to a later environment, then the fact it's adaptive to the current environment can also be a lucky coincidence.",evo
0.733,But the point is that the Biblical flood was supposed to have killed every living thing on earth except what was on the ark with 8 people.,evo
0.7005,But why is the unselected step of random mutation a problem?,evo
0.6646666667,"If you have two different componets that evolve separately, when placed together, they can also begin to serve a third purpose when they are together due to their interactions with eachother.",evo
0.7303333332999999,So much for having evidence leading to theory huh?,evo
0.7140000000000001,If you're looking for significant visible changes -rather than underlying genetic ones- we can do that to.,evo
0.7223333332999999,"But still, we know that they are only quite recently divergant and the various populations interbreed in only unusual situations - like when mates of the same species are not available due to extreme population reduction.",evo
0.6393333333,but atheism in this case is not a belief but the lack of it.,evo
0.7290000000000001,So your saying I have no right to disagree unless I can prove and refute evolution and science.,evo
0.72825,Do you believe the genome contains information or not?,evo
0.6723333333,But a literalistic interpretation of the Bible was rejected or amended by believing christians long before Darwin sailed in the Beagle.,evo
0.7275,"But when the breeding always produces infertile offspring, then its an evolutionary dead-end.",evo
