rank,argument,topic
0.8474285714,"If you're so convinced that 'gun-control' works, then why don't you place a sign on your door or in your front yard that reads: ""DOING MY PART FOR GUN-CONTROL: THIS IS A GUN-FREE HOME!""",gc
0.8461666667000001,"So,in your opinion,are you saying that this invading force that you are talking about,would never bat an eye as to whether the people of the USA are armed to the teeth or not in their pre-war planning?",gc
0.8688333333,"if there were no guns, there would be no armed intruders.",gc
0.8435,"If private firearms were to be made illegal across the board, I suggest to you the civil unrest you speak of would be epidemic in our nation.",gc
0.87775,If guns were not so readily available in America there would be far less shootings.,gc
0.8592,I agree its a proven fact owning a gun decimates the odds that your going to get robbed or any other attack on your property or on you,gc
0.8398571429,"If you had suggested to the Founders that the 2nd Amendment didnt protect an individual right to keep and bear arms, you would have had quite a debate on your hands.",gc
0.85475,"This court now realizes just about any gun is immune from federal controls at this point and it reluctantly but unequivocally says . . . * ""Another objection to the rule of the Miller case as a full and general statement is that according to it Congress would be prevented by the Second Amendment from regulating the possession or use by private persons not present or prospective members of any military unit, of distinctly military arms, such as machine guns, trench mortars, anti-tank or anti-aircraft guns, even though under the circumstances surrounding such possession or use it would be inconceivable that a private person could have any legitimate reason for having such a weapon.",gc
0.8347142857,"but most burgerlery's happen when you arn't even home, in which case the gun is mostly likly to be stolen itself.",gc
0.8341666667000001,"If I am carrying for protection, I myself, will have less chance of becoming the victum of crime.",gc
0.8304,"First priciple: gun control must not change, modify, or engineer good citizens.",gc
0.8338571429,"If I may suggest to all; 'A repeal of the Second Amendment, alone, will not automatically exclude gun owners from owning firearms.",gc
0.8540000000000001,"If you sell your car legally and I get into an accident with the person you sold it to should I also sue you for selling it to that person of course not, now do you see how stupid it is to hold a manufacturer responcible for the actions of consumers.",gc
0.8315714286,"Yes, but when the second amendment came out there was no ""national guard.""",gc
0.8079999999999999,"If you intrepret the SA as meaning gun owernship for the purpose of a militia, then anyone can form a militia, and legally have military weapons.",gc
0.8411666667000001,"If no one owned weapons, then the police would be virtually unneccesary except to stop crimes committed with fists alone.",gc
0.8412,So when the gun haters deny a person the right to defend themselves they should be responsible for the person safety.,gc
0.8275,"First, let me say I do not believe God has ever spoken to man and said, 'Thou shalt own a gun'.",gc
0.826,So the right to own a firearm has created a situation wher a small group of people (roughly 10%) can violently refuse democraticly decided decissions?,gc
0.8142,"Despite Gansao's support for schools getting students adjusted for life as prisoners, I don't believe that they have any legitimate authority for deciding that a person's constitutional rights end the very instant they set foot on school property; especially when it comes to college campuses.",gc
0.825,"First, a national system would prevent this by scaring those ""friends"" into not buying the guns legally and selling them illegally, for if the guns are used in an illegal crime, that person can be held accountable.",gc
0.8224285714,"But if bear arms means, as the petitioners and the dissent think, the carrying of arms only for military purposes, one simply cannot add for the purpose of killing game.",gc
0.8224,"The government, authorities, or police do not owe it to you to protect your life.",gc
0.838,Gun owernship is most definatley a right.,gc
0.8206666667,If you are claiming gun control works in the UK because of fewer gun deaths you are wrong.,gc
0.8172,"But, star gazer, we had guns then when the Constitution was written and enshrined in the BOR and now incorporated into th 14th Civil Rights Amendment.",gc
0.8115,"First, there is a natural right of private self-defense against armed enemies or groups.",gc
0.763,"So you think it is wise that the individual citizens can own functional surface to air missiles, and/or nuclear weapons?",gc
0.9084,"USA Today (May 9, 2002) ""Since Australia's 1996 laws banning most guns and making it a crime to use a gun defensively, armed robberies rose by 51%, unarmed robberies by 37%, assaults by 24% and kidnappings by 43%.""",gc
0.816,So do you think it is OK to ignore the Constitution for national security?,gc
0.8154285714,So someone who want to take my guns is really just guessing that gun bans will reduce crime.,gc
0.8308,"If the Supreme Court really thinks that the second amendment protects an individual right, why haven't they bothered to reverse any of the rulings of the lower courts?",gc
0.8696666667,"(Contrary to Handgun Control's claim that ""all ammunition must be accounted for,"" the emergency ammunition is the only ammo that requires accounting.)",gc
0.8308333333,If anything this statement does nothing but support the position that we need to sentence gun traffickers to the mandatory ten years in prison per firearm sentence that federal law demands.,gc
0.8178,"So my answer, and apparently the way the majority of people see it, is to not allow ANY guns on planes (suprisingly: the way it is currently).",gc
0.8248333333,"If it did, the Court would have applied the Amendment's scope and restriction on the federal government's ""overreaching"" in deciding an issue of purely state militia power, not the state militia law requiring a permit for an armed march by private citizens.",gc
0.8125,"If he didn't have a gun, you wouldn't need to defend yourself from a man with a gun.",gc
0.812,First you need to be old enough to be able to legally own a weapon and vote to change laws.,gc
0.8108333333,"If Madison meant Soldiers in the Militia by the word ""people"" then infact the 1st ammendment only refers to the militia as well.",gc
0.7848,"I do believe that it is right to impose a LIMIT though, such as not allowing people other than law enforcement to take a gun on a plane or in a school.",gc
0.8074166667,"If you think that preventing you from taking a gun on a plane, into a school, into a federal building, or any other secured place is encroaching on your right to bear arms, then i am guilty as charged.",gc
0.8085,"First, yes I believe that a prohibition on the private ownership of guns would lead to an increase in our overall death tolls; it certainly didn't work as predicted in the UK, that's one of the reasons we left.",gc
0.8420000000000001,"If you make a living selling guns, you have to perform a background chek period.",gc
0.8868333333,If they have banned guns why are swords any different?,gc
0.8362,"if a criminal knows that 90% of the people that are walking around where armed and knew how to responsibly use their weapon, crime would take a huge drop.",gc
0.807,"if i am buying a gun that was made before 1895 (i think that is the correct date) it is not legaly speeking, a gun, and there are no restrictions.",gc
0.8067142856999999,"If someone breaks into my house to do harm to me, and I shoot him, I would rather go to jail, than be harmed or possibly killed.",gc
0.794,The government's supposed interest in who's buying firearms from private citizens isn't sufficient enough to severely curtail a person's right to privacy.,gc
0.8025,You try to reinterperet the 2nd amendment to fit your totalitarian argument.,gc
0.802,I agree but it is THIER RIGHT which is recognized by the second amendment.,gc
0.8014285714,I want to defend myself with a gun when the felons only have knives.,gc
0.8012,First The right to own a gun is IN the Bill of Rights???,gc
0.8266,"First off i never insinuated that was my phrase,only that i agree with it.Second of all,if you think Britain is so much better than the USA then please leave the USA,the quicker the better.And if all you anti gun people would be so kind as to send me your addresses i will send you all some cheese to go with your wine.Simple fact is nobody is going to take my guns from me unless i commit a serious crime,and im not alone in that feeling.So all your statistics and numbers arent going to change my feelings.",gc
0.7985714286,"First of all, I do not believe that our founders thought the right was absolute.",gc
0.7958,"If it isnt in the Constitution, it cannot be done.",gc
0.7684,"If we allow banning of AP bullets, big bullets will be next, then shotguns, then pistols, then hunting rifles, then bows and arrows, then knives, then nail-clippers, then bats.",gc
0.7946,"So after we ban guns, we ban knives, right?",gc
0.7943333333,"First off lets assume that if you are allowed to bring guns on board, then the terrorist will be wearing bullet proof vests just for protection.",gc
0.76875,"If we take our protection, and make it illegal, then the bad guys will get the guns, break into your house and you will say, ""Atleast I can protect myself with my gun.",gc
0.7804,So when I hear someone say that taking guns off the streat will reduce crime I know they are taking out of thier a**.,gc
0.7931666667,"If your state doesn't allow machineguns, a favorable ruling on the Stewart case would not change your ability to own a machinegun.",gc
0.8078333333,"If a common man can use, own, and store modern military weapons as safe or even safer than the state, by what logic do you argue that only the state should have them?",gc
0.792,So Japan that has an absolute total ban on handgun ownership actually has more than four times the handgun-related murder rate of Australia where handgun ownership is restricted but still legal?,gc
0.7916,If you have a gun there's a better chance of him seeing the gun and running.,gc
0.7509999999999999,Did the people on the gun free airplanes on 9/11 die a gentler kinder deaths because there were no guns on the airplanes?,gc
0.80675,"First, you mention the UK, where absolutely nobody can own a handgun, suggesting a total ban on ownership or possession is what you believe would be an answer.",gc
0.7884285714,First off pulling out a firearm is illegal.,gc
0.7923333333,"If you buy a gun for self defense, the most likely outcome is that you will never shoot anybody with it?",gc
0.774,"First off, in Jeffersons papers, as collected at the library of congress, the smitsonian, and other institutions, he uses the term ""Bear Arms"" a total of 347 times.",gc
0.76925,It seems inconsistent to think that the rest of the Bill of Rights is devoid of explanatory phrases like that found in the Second Amendment but that the explanatory phrase means nothing...,gc
0.7874285714,"So therefore you'd have no problem with me owning tons of Vx, Mustard Gas, Anthrax, and the means to deliver it?",gc
0.7862,A minority of gun owners are NRA members.,gc
0.7905,So 32.8% of American homes would have assault rifles- more than 23% of households in Switzerland having assault rifle.,gc
0.7859999999999999,"First, since this is my first post here and I've only been perusing this site for an hour or so, I need to know if the ""anti-gunners"" that are posting in this thread are Americans or not.",gc
0.7493333333,The government has no business knowing who has a gun.,gc
0.7831428571,So gun hater pilot wants to disarm all law abiding citizens in a world where gun hater pilot stated we must consider all people suspicious.,gc
0.8086,"So then if carrying weapons aborad a plane is legal, and they have done nothing wrong, you just trashed the Constitution.",gc
0.7902,"First, it suggests that the one who get victimized the most are the one who are unarmed, as they were without a gun to defend themselves with.",gc
0.7901666667,The only thing that registering the weapon does is let law enforcement know that an individual owns a weapon and the registration verifies that the purchaser is not a known criminal or mental patient.,gc
0.7398,"But we should ban and seize all guns thereby violating the 2nd, 4th, and 5th Amendments to that Constitution.",gc
0.7736,Gun control is about preventing such security risks.,gc
0.7802857143,"First off, a shotgun is not a good weapon for most hunting.",gc
0.7572,"So what is wrong with a total ammunition ban then, in addition to the gun ban as dogs could sniff out the ammunition being shipped in and the un shop records provide you witha lsit of gun owners.",gc
0.76075,But if you had read carefully the information that I provided you would realize: The people that already own weapons don't seem to be doing much to combat crime and are probably doing more to cause the problem than to solve it.,gc
0.779,Reading this thread I am horrified by anti-gunners logic.,gc
0.7778571429000001,So I don't see restrictions on handguns in D.C. as being a clear violation of the Second Amendment.,gc
0.7986,"If the liberals did truly get their way, and guns were outlawed, it seems like the types of guns that people posess would be likely to change.",gc
0.7609999999999999,Most legislation though is way too loose on their text specifications and would easily allow the banning of hunting firearms and cartridges.,gc
0.7762857143,"So what the hell does that have to do with anything... oh and do not tell me that the AWB was the reason... Assault weapons are used in less than .20% of crimes: ""Assault weapons are not the weapons of choice among drug dealers, gang members or criminals in general.",gc
0.755,"How exactly is owning a gun and not investing in a maximum security system that costs a seven figure sum and turning their home into a literal prison, creating conditions which promote crime?",gc
0.7758,The private ownership of firearms is to make sure we never have a dictatorship.,gc
0.7751666667,Guncontrol is a cure for gun deaths.,gc
0.7848,"So, what you are saying, is there is no constitutional protection given to the manufacturer of weapons.",gc
0.774,"Firstly - If there existed an armed forces capable of destroying the US military, then an armed civilian population would be absolutely no barrier to them.",gc
0.76825,"First, the article mentioned that the guns were in the process of being assembled and made ready for sale, suggesting that somebody is making them from parts, meaning that there has to be a factory somewhere in Australia.",gc
0.7742857143,"Firstly, the Second Amendment is a limitation on US Federal Power, not State power.",gc
0.7185,"But then those same people tried to put forth a system of checks and balances, with We the People as the final check, so that We the People would never have to do so ever again!",gc
0.7516,"It's my understanding that the police can, in most states, tell anyone who has an open-carried firearm to put in away (conceal it), and then when the person conceals it, they can then charge them for carrying a concealed weapon without a permit.",gc
0.7794,"But he still considered the right to keep and bear arms as an unalienable right, which lies at the bottom of every free government, and thus found the States bound to honor it.",gc
0.7701428571,"Outlawing alcohol didn't keep people from buying or consuming it, and outlawing guns won't keep people from buying or using them either.",gc
0.769,This was a unique situation.,gc
0.76,"Firstly, large amounts of criminal gun use are not 'professional', they are crimes of passion.",gc
0.8748,"But alas, I sincerely doubt that you care about the actual causes of violence, you just want to use the effects of our problems in order to get guns banned!",gc
0.767,"If yall want more ask I got more on this just dont feel like putting it all down, I feel as though I am beating a dead horse.",gc
0.7655714286,"But for the first 150 years of the nations existence it was assumed to be fundamental, or that the issue of whether it was fundamental or not came up, so we have 150+ years of case law assuming it was a fundamental right.",gc
0.7653333333,"But nobody is stopping you owning as many guns as you want, what's the beef now?",gc
0.765,So according to your logic a criminal would never attempt to rob someone ouside a gun-free zone?,gc
0.7633333333,It is not illegal to make weapons.,gc
0.763,30 years ago was 1973.,gc
0.7235,"If it is illegal for private citizens to sell guns at a gun show, then what prevents them from simply walking out to the parking lot and concluding the sale there?",gc
0.7626666667,"First, I will NEVER carry a gun.",gc
0.7752,"So it seems to the ant-gunners that as long as we dont have guns its good, even if more people are being rape, beat and murdered, right?",gc
0.7621666667,"First off, I believe that guns, like cars, should be legal.",gc
0.7615714286,On a crowded plane I can see people accidentally bumping into each other and someone who was joking around with their gun will pull the trigger and kill someone.,gc
0.7636666667,So roughly 28% of Americans own a firearm.,gc
0.787,"""In every year since Florida passed its loose concealed weapon law in 1987, the state has ranked either first or second among the states in violent crime.""",gc
0.7528,So then you believe the 2nd amendment guarantees an individual right?,gc
0.76,If your law states that there are no laws then it is anarchy.,gc
0.7595714286,"If ""the people"" really meant the right of states to maintain a militia, then we would be left with the absurd notion that only the states have the right to peaceably assemble, only the states have the right to be secure in their persons and property, etc.",gc
0.732,"But the thing is... would you still be saying this if it were 1 or 2 years after he bought the gun,one does not know from day to day if they are going to kill someone,let alone month to month.",gc
0.7587142856999999,"So the Cases court recognizes that if the 2nd's protection grows and expands with technology the federal government would only have the ability of regulating those arms that have been superceded by the new ""in common use at the time"" arms.",gc
0.7215,But gun control won't get rid of the guns.,gc
0.7568333333,"So you seem to be saying that only laws will be obeyed by law abiding citizens (which everyone here agrees on), so why should we have any laws anyway?",gc
0.7566666667,But the Second Amendment must be given the same respect and recognition that any other right within the Bill of Rights must be treated to.,gc
0.7557142856999999,"First this thread of yours was about criminals having machineguns after the end of the AWB, and then when you've been proven wrong and shown the holes in your argument, you backpeddle to try and blame legal devices for this ""machinegun craze"" that criminals have?",gc
0.7555714286,Maybe you could explain how prior restraint would apply in the case of requiring background checks for secondary firearm sales if it hasn't been used to Constitutionally invalidate the legal requirement for primary sales?,gc
0.69725,I agree 100% that the RIGHT thing to do is follow the Constitution.,gc
0.7552857143,lets keep it on topic.... people are not going to be running around with machine guns.... this is not logical... Personally I would carry a concealed .45 1911 like a Kimber Ultra Eclipse II and two extra clips.,gc
0.7552857143,So far I have found statistics that say gun control results in a rise in crime.,gc
0.7552857143,"Let me address the Miller decision since it came up again and a new thought hit me that I want to float here: SCOTUS explained its ruling thusIn the absence of any evidence tending to show that possession or use of a 'shotgun having a barrel of less than eighteen inches in length' at this time has some reasonable relationship to the preservation or efficiency of a well regulated militia, we cannot say that the Second Amendment guarantees the right to keep and bear such an instrument.",gc
0.7546666667,But it has been ruled as unconstitutional to require a prohibited person to register a firearm in the first place.,gc
0.8196666667,The risk is from criminals and terorist who do not obey gun comtrol laws!,gc
0.7535714286,"But the argument that goes something like, ""Your honor, I have so many guns laying around I can't be expected to know if or when any of them went missing"", sounds reasonable.",gc
0.7235,"We, NOT the government are responsible for our lives.",gc
0.7056666667,"If that isn't possible, then the local police station should make a phone bank available to do criminal checks as the sellers call in with a predetermined code verifying who they are.",gc
0.7334,But if such magazines would benefit law abiding citizens in an armed conflict then why couldn't they also benefit criminals?,gc
0.8176666667,"If forcing everyone to be armed, goes too far in terms of protecting rights, would it at least be better in terms of preventing crime?",gc
0.7438333333,"Another argument is that a ""sawed off shotgun"" had no military purpose and therefore could not aid a ""well-regulated"" (Read capable) militia.",gc
0.713,"If the criminal has the zapper to make you an easier target it means he can't use his gun either, so at the worst you are back to square one but on the other hand it is a lot harder for him to threaten you without getting you by suprise (at which point the gun zapper is a bit pointless anyway if he is going to secretly ambush you) as you can acttract attention easier and there is a much greater risk to him.",gc
0.7505,But your own link says that the rise in crime was partially explained by the new system the UK police were using for recording crime and that the British Crime Survey showed a decrease in crime since 1997.,gc
0.847,"If people view machine guns being on our streets as a time of crisis, then by God I hope they will act on that fear.",gc
0.7502,but they only effect gun killing rates just like traffic laws only effect car accidents and not other kinds of accidents,gc
0.7454,"So all laws do not affect criminals, or is it only gun control ones that they disregard?",gc
0.75,"So by your plan, we can all carry guns on the plane, that includes both law abiding citizens and terrorists alike.",gc
0.8361666667000001,Why do police who are trained to capture criminals not kill many (with a high error rate too no less) when citizens kill a lot of them?,gc
0.748,So you're saying that the modern day militia no longer utilizes privately owned weapons?,gc
0.7475714286,"If I was a terrorist, I would choose to hijack a plane if I could have a gun with me.",gc
0.6966,The occassional mass murder is a small price to pay as long as you needn't reload too often while sport shooting.emoticonXAngel,gc
0.7465714286,"First - an absolute right to carry guns, based on the constitution I countered - you waive that right in some circumstances, despite the wording of you're beloved constitution then - an attack on Australia's crime rate based on stats from the gun lobby (Doh!)",gc
0.7465,How many criminals decide to get a legal firearm then licence it and put down the real reason they want it?,gc
0.753,So now we know that the word militia was intended by the Founders to refer to the body of citizens eligible for military duty.,gc
0.7498,"A lot of folk didn't accept the 13th, 14th nor 15th Amendments either because they didn't think they were absolute and figured they would define what ""reasonable"" was too.",gc
0.7352,"But declaring that people have to keep all of their firearms locked up and stored away so children can't find them ot use them, that's unacceptable and unreasonable.",gc
0.723,So if everyone had a sign on them and a water pistol then would you be happier or does everyone need to have a gun?,gc
0.7446,If no statistics saying that Canada's strict gun laws lowered crime then the argument is dry and useless.,gc
0.742,"If criminals were worried about getting caught, they would not be breaking the law.",gc
0.7443333333,The reason for increased gun violence in Chicago and DC is the increase in poverty.,gc
0.74325,But will the magazines themselves become scarce?,gc
0.86275,If gun bans worked there would be no gun deaths in the countries that have banned guns.,gc
0.7411428570999999,"First of all, are you expecting Americans to register all 300 million guns?",gc
0.865,"If you choose to take the course, choose to get your certificate, choose to buy a gun in the mandated time, choose to practice regularly, choose to know all the state laws (like reciprocation - where you can go with the gun or not)...then you still have to walk out the door knowing one thing: if you chose to carry concealed, you MUST be ready to USE that gun for your protection (BTW: in my family of 10 people, 5 have pistol permits and 2 of those are for Concealed Carry)",gc
0.7072,"The simple fact that urban environments contains elements that would promote certain criminal actions does not mean that the policies of liberal minded politicians -policies that are not always in line with the constitution of the United States, which is the measure by which all laws are held to- can be implemented and readily enforced.",gc
0.7208,First Amendment decisions have consistently held in a wide variety of contexts that the compelling-state-interest test is applicable not only to outright denials but also to restraints that make exercise of those rights more difficult.,gc
0.7397142857,"Why dont you have any, because there are NONE that say that, there are no UN BAISED stats that say that gun control lowers crime!",gc
0.7367142857,So tell us safety Nazis just what good is the added security at the airports if it cannot keep illegal drugs and guns off of the airplanes?,gc
