rank,argument,topic
1.0,"Sorry for the length of the post, but I hope it helps you understand why I oppose capital punishment.",dp
1.0,I am all for the death penalty.,dp
1.0,I am pro death penalty.,dp
1.0,"I can't believe that you just said ""So what if Jesus said....?""",dp
0.9990000000000001,So what does he have to do with a debate like this about murderers and the death penalty?,dp
0.9905,i am against the death penalty for moral reasons.,dp
0.9752,The main reasons I oppose the death penalty are: #1) It is permanent.,dp
0.9726,"If it was your wife/daughter/mom etc. that was murdered and/or raped you would probably think different Sure, I would want whoever did it to be sentenced to death.",dp
0.9716666667,"So I'm completely up front about it, I am adamently opposed to the death penalty period.",dp
0.971,"If we continue to allow the death penalty, we are no better than the murderers and rapists that we punish with the death penalty.",dp
0.97,But I am not for the death penalty.,dp
0.9690000000000001,"Thistown~ I seem to be missing the time when ""Jesus Christ told us point blank that capitol punishment was downright evil.""",dp
0.9690000000000001,In Matthew 12 the pharisees caught the disciples of Jesus breaking the Sabbath Day.,dp
0.9682,"If a dog bit a human, they would be put down, so why no do the same to a human?",dp
0.9670000000000001,So your argument is that if the death penalty was cheaper than life in prison it would have the advantage of being cheaper than life in prison.,dp
0.9634,"First, because the real facts about Death Penalty show it -from every single point of view-, as an ineffective, dangerous and extremely expensive method of punishment.",dp
0.96,So what about murderers?,dp
0.9576,"If you are going to make murder illegal, your government would be most hypocritical to allow the death penalty.",dp
0.953,"All~ For the time being, I've moved the Old Testament Law debate to a newly created thread, since this has become a thread about the Old Testament Laws in general, and not the death penalty in particular: http://www.youdebate.com/vBulletin/s...=1519#post1519 Others who wish to remain and debate the death penalty here are of course welcome to do so.",dp
0.9526,"By killing a person who murdered someone, you are just doing the same thing you are punishing him/her for.",dp
0.95,"If so, would you let someone that broke into your house kill your relatives in front of you?",dp
0.9468,Oh and the death penalty does not deter crime.,dp
0.946,"If you are going to argue for or against the death penalty, at least try to be a credit to the argument and present something that makes sense.",dp
0.9446,But I can't get past the fact that they'll be killed for killing someone else - it's hypocritical.,dp
0.9436666667,"If you judge someone to die because of your moral standards, how does that make you better than them?",dp
0.9434,An argument for putting people to death is so that they can never escape and kill again.,dp
0.94275,"Sometimes, the only way to deal with certain criminals is to end their life, simply because they don't deserve to live.",dp
0.9390000000000001,the dealth penalty does nothing to help society!,dp
0.9359999999999999,"Calli, much of the old testament law was put asunder when Christ died on the cross.",dp
0.9359999999999999,The death penalty is arbitrary.,dp
0.9354,"First, we must choose to use executions because they may save innocent life.",dp
0.935,But as per usual you have just demonstrated that you are filled with hate for another (perhaps more deserving) segment of humanity.,dp
0.9338,"Some innocent people are still sentenced to death, and that's where I see a problem.",dp
0.9329999999999999,Jesus was against the death penalty.,dp
0.9324,I'm against captial punishment for the reasons that wjim1269 gave and also I think that just because someone murders someone it doesn't mean they should automatically forfeit their own life.,dp
0.9315,"Someone who has severed someone else's ear isn't ""obviously innocent"".",dp
0.93125,If it was your wife/daughter/mom etc. that was murdered and/or raped you would probably think different And if it were you who was wrongfully convicted you might think differently as well.,dp
0.9282,what you are saying is that we should murder people because the prisons are overcrowded.,dp
0.927,"Capitol punishment is not just the execution of murderers, but the execution of anyone by the state.",dp
0.9268,The death penalty is hypocritical.,dp
0.9259999999999999,Every execution discourages 15 murders.,dp
0.9255,"If inmates in for life actually got life in 100% of the cases, I'd be more inclined to support a ban on capital punishment.",dp
0.9252,So why not just give them a life sentence rather than kill them?,dp
0.924,First Dispute: Trials You say a lot of people have been executed when they are innocent.,dp
0.9603333333,The death penalty was established so families would not fued for generations.,dp
0.9209999999999999,"If that is the case (and I am unsure to say the least) then surely the answer is (to your scenario) that they can either: a) be tried in the US but any penalty i.e. capital punihsment, that wouldn't be applied in their own nation can't be appplied post verdict or b) they can be tried in their own country but the country where the crime is committed is able to take part in the process of examination and jurisdiction.",dp
0.9206,"If it could be said for certain that a murderer, rapist, or a pedophile would get life without the possibility of parole then I might be more for that........The problem is that sentence has been given to murderers in the past and some liberal judge down the road has seen fit to release the perpetrator and allowed him to go out and murder and rape again.......... That is why I say execute them and you will not face the possibility of that happening.........",dp
0.919,But even one unjustified execution is a hundred too many.,dp
0.9176,JESUS HATED CAPITOL PUNISHMENT.,dp
0.9162,"So, the only reason I can really see why people support the death penalty is to have simple vengeance against the perpretrator.",dp
0.9156,"If as a nation, we argue that life is sacred and that it must be treated with respect, then that applies to all categories of people regardless of their actions.",dp
0.91525,"if we look at statistic, crime is increasing nowadays.",dp
0.9152,"Firstly, life in prison is a worse punishment.Death penalty it is the simplest punishment for the person who e.g. killed, raped, committed act of terrorism and etc.",dp
0.915,The death penalty is Biblically justifiable.,dp
0.9146,"If we kill a few innocent lifes in the process, thats fine by me as long as the rightfuly convicted felons are killed VIA leathal injection and/or electric chair.",dp
0.9390000000000001,"if someone chopped off your best friends head right in front of you, would they be deserving of the death penalty?",dp
0.9115,Show them God's love and mercy.,dp
0.9114,"But you have to wonder, how can there be no shred of supporting evidence after thousands of years of use, if it IS a actual deterrent?",dp
0.9112,If one person was excecuted when he was innocent than thats hundreds too many.,dp
0.9109999999999999,In my opinion the death penalty is the very wrong way to work against criminal activity like murdering!,dp
0.9098,If we are sure they raped & killed those innocent children then we should let them die.,dp
0.9083333333,But are there any stats available showing countries/states with the death penalty have a higher/lower crime rate?,dp
0.9076,these debates get so freakin repetitive JESUS MADE IT VERY VERY CLEAR THAT THE DEATH PENALTY IS WRONG.,dp
0.94275,"But think of this: should we keep the killers in jail for 100 year sentences with the possiblility of them escaping, or our jails overflowing, or should we just go with the 100 percent surefire way of keeping them off the streets just by the electric chair or lethal injecion.",dp
0.9058,If you rape a child then you deserve more than anybody to be put down and eliminated forever.,dp
0.903,"First of all, a dead man fears nothing.",dp
0.9026,If you rape a kid then you shouldn't be allowed to live.,dp
0.9022,"jdover, wjim, I think the death penalty should only be used when there is undeniable proof against the suspect.",dp
0.9018,"So phantom these offences vary greatly in severity from sexual touching to rape.are you seriouly saying a person given 2 years for touching should be murdered?In a small town in england a few years agoa group of youths beat a young girl to death for simply being a goth, where was the cry for there execution, you need to engage your brain and not let emotion cloud your views, i do not belive in the death penalty for any crime but in your world people reciving realitively small sentances of say 3 years would be executed ,by your logic anyone should then be hanged simply on the length of sentance recived you can not have one law for sex offences and a different one for others.",dp
0.9015,"""Every system has its flaws.",dp
0.9009999999999999,But there are still innocents excuted.,dp
0.9,"This debate is not about slavery it is about the death penalty, stick with the subject.",dp
0.8986666667000001,"So, if you value the life of the foeutus the same as that of the mother, why is it ok to kill the foetus because of rape or incest?",dp
0.8982,"So it's wong when some civilian commits murder, but it's fine when an authority is doing the killing?",dp
0.8956,Getting rid of the death penalty would ultimately not be more cost effective.,dp
0.8945,"So far, I am hearing ""an eye for an eye"" which is just that vengeance centered sense of justice that I am arguing against.",dp
0.8944,"If I ever ""murder"" someone without cause, I would deserve to die.",dp
0.8932,"So, seems to me that when you make death a quick (as in timely) and certain punishment, there is most definitely a deterent effect.",dp
0.89275,"So if we can assume that innocent people are convicted in capital punishment cases, shouldn't we be free to assume that innocent people are being convicted in non-capital punishment cases as well?",dp
0.8916,"ok guys, a more extensive reply is on the way, but first i have to ask you anti-capital punishment guys this: If we take your arguments to their logical extreme, we must then say that ANY FORM of ANY punishment is immoral.",dp
0.8908,If they're in prison for life they also will not kill again.,dp
0.887,the only way you can really support capitol punishment is you would be willing to do it yourself.,dp
0.8858,If the death penalty deters murder (as you claim) then why does Europe have a lower murder rate even though they've outlawed the death penalty?,dp
0.88375,Society doesn't have to go overboard - life without parole is sufficient.,dp
0.8823333333,"In 26 years the death penalty has been in effect in my home state of Illinois, there have been more people exonerated due to irrefutable evidence than have been put to death.",dp
0.882,But killing someone because of him killing someone is quite hypocritical.,dp
0.8812,"Capitol punishment is not o.k., no matter how you try to justify it, and if you are using Jesus Christ as justification, then you are definitely never going to find that justification.",dp
0.8809999999999999,Well what is your decision on whether to support the death penalty?,dp
0.88,"So the blind spot isn't mine at all, because I'm not in denial of reality in order to justify the killing of totally innocent unborn children as I argue against the legal executions of murderers who knowingly and premeditatedly steal peoples hopes, dreams and their very lives.",dp
0.8782,Dsa posted some figures on the old forum saying that less people end up dying if the death penalty is kept in place.,dp
0.8772,"Here are the stats from the time that the death penalty was reinstated in Illinois (1978) to the time that Ryan issued the mass commutation: People actually put to death: 7 People put on death row, then found innocent: 13 Should we be killing people if the justice system was wrong in AT LEAST 65% of capital cases????",dp
0.8765,"killing a person, no matter the reason, is still murder.",dp
0.8764,I finally found the stats I mentioned in an earlier post: People put to death in Illinois: 7 People exonerated due to irrefutable evidence: 13 Don't you think there's a problem when almost 2/3rds of the death penalty cases result in exoneration.,dp
0.8755,"If that was the case, then books speaking about the history and highlighting the corruption of the 18th century would have never even been published in 2010.",dp
0.8725,If she was raped she had the right to kill him to stop the abuse.,dp
0.8714,"But the way i look at it is that whatever one person does to another, especially if it causes death or extreme hospital bills, they deserve to have it done to them as well.",dp
0.8713333333,Some poll numbers showing most Americans opinions about captial punishment: http://www.deathpenaltyinfo.org/arti...10#FoxNews0001,dp
0.8712,But the statistics don't support the idea that the death penalty is any more effective as a detterent than is a life sentence.,dp
0.871,both me and thistown have quoted Jesus to support our stance on the death penalty.,dp
0.87025,Death penalty cases cost way more because they usual go through a series of costly appeals.,dp
0.8702,it is quite clear that Jesus did not support the death penalty.,dp
0.9213333333,But Saddam thought that Sharia law was too harsh to be used in general practice.,dp
0.8683333333,"No, I am not sure... Your cocksure attitude intimating that there is not much chance you could end up falsly convicted and excecuted makes me wonder if the reason for that attitude is that you fall into the category of middle class Anglo.",dp
0.868,ya patriot i dont understand that either i remember seeing on tv a guy who was sentanced back in the mid 80s and just now getting the needle is there a reason for this?,dp
0.9305,"Oh I'm not saying that the govenrment should do away with the death penalty on these grounds, I'm saying that Christian people should oppose it, you said it yourself.",dp
0.93175,"Even if you take capitol punishment completely out of the realm of God and religion, specifically Christianity, it is wrong.",dp
0.8640000000000001,if someone has comitted a terrible crime bad enough to be on death penalty then i think theres no way that person can be rehabilitated and put back into society.,dp
0.8622,"Some human beings have proven they have forfeited the right to continue to breathe the same air as civilized people, PERIOD!!!",dp
0.8618,"Even if you choose to cling to these Old Testament laws at least admit that Jesus Christ, the man who defines and embodies what it is to be a Christian HATED the death penalty.",dp
0.8615,But this warped society would rather fight for the right to kill the most dependent beings on the planet and make excuses for the killers.,dp
0.8612,But life imprisonment without parole also deters the criminal from recommitting.,dp
0.861,If it were me paying for it all lifers would die.,dp
0.861,"But as long as they are only options, I support the criminals right to choose that particular method.",dp
0.934,"First off, the point of the death penalty is not to prevent future killings, it is there to give justice.",dp
0.86,"So the Creons, Torquemadas and Jauverts of the world have always believed, much to their, and our, detriment.",dp
0.8590000000000001,"So in reality, pushing the death penalty only ensures that more innocent people will be murdered.",dp
0.8584,so you kill ten people in a gun massacre and it warrants you an easy cared for life and a possibility of release?,dp
0.8817777778,But Jesus Christ told us point blank that capitol punishment was downright evil.,dp
0.8582,"If someone killed a relative of mine, I'd want to PERSONALLY throw the switch or put a bullet in their head.",dp
0.8582,"First of all, judging the death penalty by comparing the United States to Europe is not going to do any good.",dp
0.89825,"We need to halt the death penalty before anyone else gets unjustly sentenced, then fix the problems (if that is even possible), and then, when we have safeguards in place, reinstitute it.",dp
0.858,DNA testing may become useless soon because there is a new practice going on where prisoners sell a sample of their DNA which is placed at the scene of the crime to confuse the investigation.,dp
0.91375,"But if the state kills an innocent man, THAT is irreversible.",dp
0.89525,So because we might kill an innocent that means we should stop killing ALL murderers?,dp
0.9265,If you read my arguments clearly you would understand that i said capital punishment if used more often will deter crime.,dp
0.85625,"So what is one supposed to do if a criminal violently attacks a member of his family, just sit idly back and watch a soft judicial system set the criminal free after a short stay in prison, or get off on a technicality because the arresting officer didnt use proper punctuation in the report.",dp
0.8558,No death penalty = less prison space = more money spent on building new prisons = no money saved The amount of people in the prisons would quickly build up and we would have to build more prisons.,dp
0.8545,"But why not put him in a 6x6 cell, no tv, no outside contact, no magazines: just him and 4 walls, a meal a day and a grate in the floor for bodily needs.",dp
0.8540000000000001,"The Bible doesn't go against the death penalty, it supports it.",dp
0.85175,"So, in your opinon, a person who rapes little kids is just as valuable a member of society as somebody who feeds hungry people in a soup kitchen?",dp
0.899,"But if that one doesn't wash for you, here's another argument against the deterent factor (and I must credit a bunch of wonderful schools debaters from a disadvantaged community in the third world for this): A. Executions in the modern 'civilised' world take place behind closed doors in a sealed room with sterile instruments and all the advantages of medical science.",dp
0.85125,But I oppose the death penalty because it has the capacity to kill innocent people.,dp
0.85,"Darknight, This is a good point that I agree with and another Pro for capital punishment.",dp
0.84875,If someone kills a massive number of people is it fair in the victims eyes to have someone sit in jail for the rest of their lives?,dp
0.8486,"if a person kills another person it is murder, whether it is sanctioned by the state or not.",dp
0.8486,"But a person who disregarded the rights of the victim, in effect denying that person the right to be alive and suffered the terror of life leaving their body should not be given the right to enjoy more breath than it takes to deliver them to a gallows.",dp
0.8482,"If they don't want to die, then I suggest they don't steal, murder, etc.",dp
0.848,Something quite different than when you're pushed infront of some detectives and actually questioned over your motives for murdering someone.,dp
0.847,"First, the Bill of Rights was written by people who supported the death penalty, therefore it cannot be contradictory to the views of those who are in favor of imposing capital punishment.",dp
0.8466666667,In one case it took them 21 years before the murderer was finally killed.,dp
0.8462222222,"If you want to kill somebody, then expect the consequences of your actions.",dp
0.861,So how about we stop a penalty that has executed innocents?,dp
0.845,"Society is brutalized by the maintenance and release of such criminals, not their execution.",dp
0.845,If he went to trial I would not want him to be humanely put to sleep.,dp
0.8448,"If they know they'll die if caught, they'll likely kill more rape victims and children.",dp
0.8445,but do u think criminals fear death?,dp
0.8444,"If the government should have the duty to protect all of its citizens, it should extend especially to the murderer.",dp
0.8444,"If the same murderer had been given the death penalty, and never released in the first place, he would not be able to kill again.",dp
0.8443333332999999,there are a whole slew of laws in the old testament that are ridiculous and are not applicable any more.,dp
0.8440000000000001,- Calli You have absolutely no idea what you're talking about.,dp
0.8440000000000001,"If the government does happen to be repressive, who's to say enough people will rise up?",dp
0.8440000000000001,"No, we shouldn't abolish every flawed system.",dp
0.8440000000000001,"So, in summary, you aren't against the death penalty on principle.",dp
0.84375,"Some people facing the death penalty have been exonerated, sometimes only minutes before their scheduled execution.",dp
0.84325,"If I was thinking of commiting murder, then I would certainly prefer to be executed quickly and painlessly, as it is done today (gas chamber, lethal injection, etc.) Most criminals that commit crimes DO NOT have the intention of being caught, so they do not often take the possible punishment into account.",dp
0.8420000000000001,"The ""Central Park Jogger"" case involved a person who confessed who probably was guilty.",dp
0.87825,I would support the death penalty IF there was a way to ensure that it would not put innocent people to death.,dp
0.8414,"Dirtynumbangel, ""It would be more of a punishment to lock someone up for their whole lives than to kill them, that's the easy way out"" Would you honestly rather be put to death than spend it in jail.",dp
0.8414,"First of all, I am against death penalty.... but if it related to children I am cruel!",dp
0.841,"But on another note, I wonder whether he wouldn't rather be sentenced to death than put with the general prison population.",dp
0.8405,"If you just shot suspects without a trial it'd be even cheaper, it'd probably have a decent deterrent effect too.",dp
0.8395,If these monsters are allowed to live in our society we allow the cancer to live.,dp
0.8388,"Firstly, many people say that Europe does not have the death penalty so the U.S should not.",dp
0.83875,"I'll even prove it and save this woman who should be executed under the Old Law, yes she should be executed but since Christianity is about love and forgiveness and seeing as how much I hate the death penalty I'm going to stand up and face an angry mob of men with stones alone.",dp
0.8386,"If there was a justice system that was equally fair to all accused, made no mistakes and only executed the guilty, proponents of the death penalty could rightly cry, ""Fry 'um up"".",dp
0.8372,"A man sins (murder), we know that he needs help, he is apparently far from God and since it is our mission to tell him about what he could be outside of himself...we kill him, never give him a chance to change, completely and instantly banish him to an eternity in Hell so that we humans can have our primitive neanderthal sense of vengeance fulfilled.",dp
0.8370000000000001,"Some crimes are so terrible, life in prison just isn't enough.",dp
0.83625,If there was no justifiable reason for the murder then I don't care who kills the bastard... the state or a civilian.,dp
0.83625,"Bottom line, he rebuked it, calling it an ""evil"", he stopped people trying to put someone to death under the same laws that you love to quote, and then he forgave the very people that killed him in his last breath.",dp
0.836,"Ok, Im gonna try to parry every point made against the death penalty from my first post to this one: Cool Hand Dave was the first to respond to my post.",dp
0.8656666667,Society today allows the criminal more rights than the victims.,dp
0.83525,"20 If anyone with malice aforethought shoves another or throws something at him intentionally so that he dies 21 or if in hostility he hits him with his fist so that he dies, that person shall be put to death; he is a murderer.",dp
0.83475,"If it was an accident, then it was not murder.",dp
0.83425,"If they were dead, then they wouldn't have killed anyone...",dp
0.8338,"Christ taught us in the beatitudes that we should not ""take an eye for an eye"".",dp
0.8336,"If you give death sentence to a suicide bomber, you give him what he wanted in the first place.",dp
0.8332,"Yes, but until we can fix the justice system, we should cut down on the amount of death penalties being given out.",dp
0.83275,"Only .06% of people who have killed kill again when they escape, are released, etc.",dp
0.8325,"But, I am glad you didn't let it (revenge) effect you to the point of taking his life yourself.",dp
0.83175,"But Ghandi says ""an eye for an eye"" will make the whole world blind.",dp
0.8315,"If the victim lives through the ordeal, then the victim decides the criminals fate.",dp
0.80675,"Summary: You've always been told an eye for an eye, but I say that it is evil.",dp
0.8273333333,If you do the crime you need to take responsibility for the time.,dp
0.87575,"Here is what I am saying, Jesus is the ultimate authority, he not only strongly condemned capitol punishment, but he took an active role to do away with the evil.",dp
0.8266,"Yes but the bible never said another man should do the job, we are trying to play God by killing off people who we thinnk are ""bad"".",dp
0.83375,"So, you want to say that because of money or number of prisons, we should kill criminals??",dp
0.86775,"Someone who commits a crime that serious should at least be behind bars for the rest of their life, no parole at all.",dp
0.8236,"So if somebody is found guilty and sentenced to death based solely on the information provided, and it's discovered too late that the evidence was incomplete then that's simply too bad, but there's nothing we can do about it.",dp
0.8223333333,"If we don't stop it before we try to fix it, we will make it harder to fix and we will create more of a mess.",dp
0.82175,"If we put them in jail, it is reversable.",dp
0.8215,If you ask any criminal on death row if he would like to have his sentence commuted to life in prison every one of them would take that in a heartbeat......,dp
